{
  "doctor_handshake_sha": "sha256:aaaaaaaaaaaaaaaaaaaaaaaaaaaaaaaaaaaaaaaaaaaaaaaaaaaaaaaaaaaaaaaa",
  "dry_run": true,
  "execution_started": false,
  "fallback": {
    "from_capabilities": ["edit", "validate"],
    "reason_code": null,
    "to_capabilities": ["edit", "validate"],
    "used": false
  },
  "model_provider_started": false,
  "reason_code": null,
  "receipt_hash": "sha256:7595382409f9cfc040a0c0f65c10019ed720bcc45cd64a2c7585ec70c1dbf33d",
  "required_capabilities": ["edit", "validate"],
  "schema": "simplicio.executor-negotiation-receipt/v1",
  "selected": {
    "capabilities": ["edit", "validate"],
    "capability_evidence": {
      "edit": {
        "evidence_ref": "doctor:test:edit",
        "status": "verified"
      },
      "validate": {
        "evidence_ref": "doctor:test:validate",
        "status": "verified"
      }
    },
    "compatibility": 100,
    "component": "simplicio-fast",
    "cost_rank": 10,
    "doctor_reason_code": "verified",
    "doctor_status": "available",
    "executor_id": "fast-rust",
    "language": "rust",
    "offline": true,
    "parity_contract_hash": "sha256:bbbbbbbbbbbbbbbbbbbbbbbbbbbbbbbbbbbbbbbbbbbbbbbbbbbbbbbbbbbbbbbb",
    "parity_status": "verified",
    "reason_code": null
  },
  "skipped": [
    {
      "executor_id": "fast-python",
      "option": 0,
      "reason_code": "ranked_lower",
      "status": "skipped"
    }
  ],
  "stage_id": "execute",
  "status": "SELECTED",
  "unavailable": []
}
